{
  "schema_version": 1,
  "codex_version": "0.1.0-fixture",
  "build_sha": null,
  "surface": "plugin",
  "platform": {
    "os": "macos",
    "arch": "arm64",
    "sandbox_class": "plugin_runtime"
  },
  "failure_phase": "hook_load",
  "error": {
    "class": "PluginLoadError",
    "normalized_message": "plugin change reappears after reconciliation",
    "message_digest": "28b8c68eee18fc656c745a392025cf2c478cd33f166ed9692b828fa32c51b1f4"
  },
  "stack_frames": [
    {
      "module": "plugin-loader",
      "file": "entry.js",
      "symbol": "load_plugin",
      "line_bucket": 10
    }
  ],
  "config_keys": [],
  "feature_ids": [
    "bundled_plugin"
  ],
  "artifact_hashes": [],
  "ast_signature_ids": [],
  "local_facts_digest": "62a2fed3d6e08c44835fce71f02210b1ddabfb066e39edf1e6c261988f824dd3"
}
