{
  "schema_version": 1,
  "codex_version": null,
  "build_sha": null,
  "surface": "browser_control",
  "platform": {
    "os": "macos",
    "arch": "arm64",
    "sandbox_class": "desktop_extension_runtime"
  },
  "failure_phase": "extension_handshake",
  "error": {
    "class": "TypeError",
    "normalized_message": "protected global process binding rejected assignment",
    "message_digest": "3db6819d59600a85a1e86ed79148a47751eff83ca98019e8e17237c128ea12a4"
  },
  "stack_frames": [
    {
      "module": "browser-client",
      "file": "browser-client.mjs",
      "symbol": "module_initialization",
      "line_bucket": 30
    }
  ],
  "config_keys": [],
  "feature_ids": [
    "browser_control"
  ],
  "artifact_hashes": [
    {
      "path_alias": "BROWSER_CLIENT_COPY_A",
      "sha256": "33af4a7ad7a4ec2d18cb928a2ef69922e69031007dd07672334c5fe45faec48f"
    }
  ],
  "ast_signature_ids": [
    "js.global-process-shim-redefinition.v1"
  ],
  "local_facts_digest": "5ce3c4fd7c7367c405bffad83d9f18ceaeb4eca31ca485760cddd0c27a316077"
}
